{
  "program_id": "ppl_classic_4w_v1",
  "version": "1.0.0",
  "name": "PPL Clásico — Push / Pull / Legs (4 semanas / 5 días)",
  "description": "Variante 1: Separación clásica Push/Pull/Legs. D1 (Push): pecho×2 + tríceps×2 + hombros accesorio. D2 (Pull): espalda×2 + bíceps×2 + deltoides posterior. D3: conditioning opcional. D4 (Legs): cuádriceps×2 + femorales×2 + glúteos con énfasis fuerza-hipertrofia. D5 (Upper Full): upper body completo, 1 slot por grupo. Máxima frecuencia por grupo muscular.",
  "parameter_spec": {
    "fields": [
      {
        "key": "athlete.level",
        "type": "enum",
        "enum": ["novice", "intermediate", "advanced"],
        "required": true
      },
      {
        "key": "athlete.equipment",
        "type": "string_array",
        "required": true
      },
      {
        "key": "athlete.restrictions",
        "type": "string_array",
        "required": false,
        "default_expr": "[]"
      },
      {
        "key": "rules.accessory_rir_target",
        "type": "number",
        "required": true,
        "min": 0,
        "max": 5,
        "default_expr": "2"
      },
      {
        "key": "rules.rounding_profile",
        "type": "enum",
        "enum": ["none", "plate_2p5kg", "db_2kg"],
        "required": true,
        "default_expr": "'plate_2p5kg'"
      }
    ]
  },
  "exercise_library_ref": {
    "type": "file",
    "path": "data/exercise_library_v1.json"
  },
  "template": {
    "weeks": { "min": 4, "max": 4 },
    "days_per_week": { "min": 4, "max": 5 },
    "sessions": [
      {
        "day_index": 1,
        "tags": ["push", "chest_focus"],
        "optional": false,
        "blocks": [
          {
            "id": "d1_chest1",
            "type": "main_lift",
            "tags": ["chest", "horizontal_push"],
            "exercise_selector": {
              "count": 1,
              "include_tags": ["chest", "horizontal_push", "bench_main", "bench_secondary"],
              "prefer_tags": ["compound", "barbell"]
            },
            "prescription_ref": "rx_hyp_chest"
          },
          {
            "id": "d1_chest2",
            "type": "secondary_lift",
            "tags": ["chest", "upper_chest"],
            "exercise_selector": {
              "count": 1,
              "include_tags": ["chest", "chest_accessory", "upper_chest", "press_secondary"],
              "prefer_tags": ["dumbbell", "cable"]
            },
            "prescription_ref": "rx_hyp_chest"
          },
          {
            "id": "d1_tri1",
            "type": "accessory",
            "tags": ["triceps"],
            "exercise_selector": {
              "count": 1,
              "include_tags": ["triceps", "triceps_accessory"]
            },
            "prescription_ref": "rx_hyp_tri"
          },
          {
            "id": "d1_tri2",
            "type": "accessory",
            "tags": ["triceps"],
            "exercise_selector": {
              "count": 1,
              "include_tags": ["triceps", "triceps_accessory"]
            },
            "prescription_ref": "rx_hyp_tri"
          },
          {
            "id": "d1_delts",
            "type": "accessory",
            "tags": ["delts", "shoulders"],
            "exercise_selector": {
              "count": 1,
              "include_tags": ["delts_lateral", "delts_front", "delts_side", "ohp_secondary", "vertical_push"]
            },
            "prescription_ref": "rx_hyp_delts"
          },
          {
            "id": "d1_abs",
            "type": "accessory",
            "tags": ["core", "abs"],
            "exercise_selector": {
              "count": 1,
              "include_tags": ["abs", "core", "core_anti_extension", "core_flexion"]
            },
            "prescription_ref": "rx_timed_abs"
          }
        ]
      },
      {
        "day_index": 2,
        "tags": ["pull", "back_focus"],
        "optional": false,
        "blocks": [
          {
            "id": "d2_back1",
            "type": "main_lift",
            "tags": ["back", "vertical_pull"],
            "exercise_selector": {
              "count": 1,
              "include_tags": ["vertical_pull_main", "vertical_pull_secondary", "back"],
              "prefer_tags": ["compound", "barbell"]
            },
            "prescription_ref": "rx_hyp_back"
          },
          {
            "id": "d2_back2",
            "type": "secondary_lift",
            "tags": ["back", "horizontal_pull"],
            "exercise_selector": {
              "count": 1,
              "include_tags": ["horizontal_pull_secondary", "horizontal_pull_accessory", "back"],
              "prefer_tags": ["horizontal_pull", "barbell"]
            },
            "prescription_ref": "rx_hyp_back"
          },
          {
            "id": "d2_bi1",
            "type": "accessory",
            "tags": ["biceps"],
            "exercise_selector": {
              "count": 1,
              "include_tags": ["biceps", "biceps_accessory"]
            },
            "prescription_ref": "rx_hyp_bi"
          },
          {
            "id": "d2_bi2",
            "type": "accessory",
            "tags": ["biceps"],
            "exercise_selector": {
              "count": 1,
              "include_tags": ["biceps", "biceps_accessory"]
            },
            "prescription_ref": "rx_hyp_bi"
          },
          {
            "id": "d2_rear_delts",
            "type": "accessory",
            "tags": ["delts_rear"],
            "exercise_selector": {
              "count": 1,
              "include_tags": ["delts_rear", "rear_delt"]
            },
            "prescription_ref": "rx_hyp_delts"
          },
          {
            "id": "d2_abs",
            "type": "accessory",
            "tags": ["core", "abs"],
            "exercise_selector": {
              "count": 1,
              "include_tags": ["abs", "core", "core_anti_extension", "core_flexion"]
            },
            "prescription_ref": "rx_timed_abs"
          }
        ]
      },
      {
        "day_index": 3,
        "tags": ["conditioning"],
        "optional": true,
        "blocks": [
          {
            "id": "d3_conditioning",
            "type": "conditioning_steady",
            "tags": ["conditioning", "cardio"],
            "exercise_selector": {
              "count": 1,
              "include_tags": ["carry", "core", "core_anti_rotation"]
            },
            "prescription_ref": "rx_conditioning_steady"
          }
        ]
      },
      {
        "day_index": 4,
        "tags": ["legs", "lower"],
        "optional": false,
        "blocks": [
          {
            "id": "d4_quad1",
            "type": "main_lift",
            "tags": ["quads", "squat"],
            "exercise_selector": {
              "count": 1,
              "include_tags": ["squat_main", "squat_secondary"],
              "prefer_tags": ["barbell", "compound"]
            },
            "prescription_ref": "rx_strength_lower"
          },
          {
            "id": "d4_quad2",
            "type": "secondary_lift",
            "tags": ["quads"],
            "exercise_selector": {
              "count": 1,
              "include_tags": ["quads", "quads_accessory", "quads_isolation"]
            },
            "prescription_ref": "rx_strength_lower"
          },
          {
            "id": "d4_ham1",
            "type": "secondary_lift",
            "tags": ["hamstrings", "hinge"],
            "exercise_selector": {
              "count": 1,
              "include_tags": ["hinge_secondary", "hamstrings", "hamstrings_accessory"],
              "prefer_tags": ["compound", "barbell"]
            },
            "prescription_ref": "rx_strength_lower"
          },
          {
            "id": "d4_ham2",
            "type": "accessory",
            "tags": ["hamstrings"],
            "exercise_selector": {
              "count": 1,
              "include_tags": ["hamstrings_isolation", "hamstrings_accessory"]
            },
            "prescription_ref": "rx_strength_lower"
          },
          {
            "id": "d4_glutes",
            "type": "accessory",
            "tags": ["glutes"],
            "exercise_selector": {
              "count": 1,
              "include_tags": ["glutes", "glutes_accessory", "glutes_isolation"]
            },
            "prescription_ref": "rx_hyp_glutes"
          },
          {
            "id": "d4_abs",
            "type": "accessory",
            "tags": ["core", "abs"],
            "exercise_selector": {
              "count": 1,
              "include_tags": ["abs", "core", "core_anti_extension", "core_flexion"]
            },
            "prescription_ref": "rx_timed_abs"
          }
        ]
      },
      {
        "day_index": 5,
        "tags": ["upper", "full_upper"],
        "optional": false,
        "blocks": [
          {
            "id": "d5_chest",
            "type": "main_lift",
            "tags": ["chest"],
            "exercise_selector": {
              "count": 1,
              "include_tags": ["chest", "horizontal_push", "bench_secondary", "press_secondary"]
            },
            "prescription_ref": "rx_hyp_chest"
          },
          {
            "id": "d5_back",
            "type": "secondary_lift",
            "tags": ["back"],
            "exercise_selector": {
              "count": 1,
              "include_tags": ["horizontal_pull_secondary", "vertical_pull_secondary", "back"]
            },
            "prescription_ref": "rx_hyp_back"
          },
          {
            "id": "d5_delts",
            "type": "accessory",
            "tags": ["delts", "shoulders"],
            "exercise_selector": {
              "count": 1,
              "include_tags": ["delts_lateral", "delts_front", "delts_side", "ohp_secondary"]
            },
            "prescription_ref": "rx_hyp_delts"
          },
          {
            "id": "d5_tri",
            "type": "accessory",
            "tags": ["triceps"],